{
  "all_passed": false,
  "any_failed": false,
  "cases": {
    "CORE-001": {
      "blocked_by": null,
      "case_id": "CORE-001",
      "commands": [
        {
          "argv": [
            "/tmp/core311/bitcoin-31.1/bin/bitcoind",
            "--version"
          ],
          "cwd": "/Users/cdjk/Downloads/ranklock-v0.25.2-claude-handoff/work/ranklock-v0.25.1",
          "duration_ms": 6,
          "env_digest": "9ac864309bcf14459523fdd45782bc8dd2c2b4c03d334b640da8259be7be821b",
          "exit_code": 0,
          "finished_at_utc": "2026-08-16T04:18:33.582480Z",
          "schema": "ranklock-v0252-command-record-v1",
          "started_at_utc": "2026-08-16T04:18:33.576039Z",
          "stderr_path": "results/v0252_logs/core-matrix-bitcoind-version.20260816T041833575774Z.stderr.log",
          "stderr_sha256": "e3b0c44298fc1c149afbf4c8996fb92427ae41e4649b934ca495991b7852b855",
          "stdout_path": "results/v0252_logs/core-matrix-bitcoind-version.20260816T041833575774Z.stdout.log",
          "stdout_sha256": "f2d7763364b8738a7e4b486d3d22f14b731a8be4c4d966a4f0f22273b24c593c",
          "timed_out": false
        }
      ],
      "description": "pinned Bitcoin Core identity",
      "evidence": {
        "bitcoind_path": "/tmp/core311/bitcoin-31.1/bin/bitcoind",
        "expected_bitcoind_sha256": "d55c12b0b02001cc16b1481c4075361dcba193100a8143924abda911174c09ec",
        "expected_numeric_version": 310100,
        "expected_release": "31.1",
        "observed_bitcoind_sha256": "d55c12b0b02001cc16b1481c4075361dcba193100a8143924abda911174c09ec",
        "observed_numeric_version": 310100,
        "observed_subversion": "/Satoshi:31.1.0/"
      },
      "schema": "ranklock-v0252-case-result-v1",
      "status": "passed"
    },
    "CORE-002": {
      "blocked_by": null,
      "case_id": "CORE-002",
      "commands": [
        {
          "argv": [
            "/tmp/core311/bitcoin-31.1/bin/bitcoind",
            "--version"
          ],
          "cwd": "/Users/cdjk/Downloads/ranklock-v0.25.2-claude-handoff/work/ranklock-v0.25.1",
          "duration_ms": 6,
          "env_digest": "9ac864309bcf14459523fdd45782bc8dd2c2b4c03d334b640da8259be7be821b",
          "exit_code": 0,
          "finished_at_utc": "2026-08-16T04:18:33.582480Z",
          "schema": "ranklock-v0252-command-record-v1",
          "started_at_utc": "2026-08-16T04:18:33.576039Z",
          "stderr_path": "results/v0252_logs/core-matrix-bitcoind-version.20260816T041833575774Z.stderr.log",
          "stderr_sha256": "e3b0c44298fc1c149afbf4c8996fb92427ae41e4649b934ca495991b7852b855",
          "stdout_path": "results/v0252_logs/core-matrix-bitcoind-version.20260816T041833575774Z.stdout.log",
          "stdout_sha256": "f2d7763364b8738a7e4b486d3d22f14b731a8be4c4d966a4f0f22273b24c593c",
          "timed_out": false
        }
      ],
      "description": "valid slot 0 authorization end to end",
      "evidence": {
        "block_hash": "569c896f1650e25f8f5565fbf1d775d171b8d2ce0c7a01f1aa9e9651206f7d50",
        "confirmations": 6,
        "labels_released_before_broadcast": true,
        "mempool_policy_allowed": true,
        "program_seed_commitment": "4c112f2906ce605dde0403fc897393203879c0d17fe5f1516feda82b32a9a274",
        "raw_transaction_sha256": "d014ebe98bcdb92af7928fbee95c364d465ad7cc990e09a99ece8c79709fc7fa",
        "seed_released_only_after_confirmation": true,
        "selector_items": 512,
        "standard_policy_enabled": true,
        "txid": "ceacf2d1aa74ae1b2da611c209b3e23f27fe09f1818696926f8cecbe3ca95ff5",
        "witness_policy_sha256": "d57492ba0c34e8103a442d7c27bf64935161a956590a817c8fdbfdb2657351fd",
        "wtxid": "32c642759a0f7d0b3a0d35ab17d49fcf2c990be305fc1d08108502d9942c09d7"
      },
      "schema": "ranklock-v0252-case-result-v1",
      "status": "passed"
    },
    "CORE-003": {
      "blocked_by": null,
      "case_id": "CORE-003",
      "commands": [
        {
          "argv": [
            "/tmp/core311/bitcoin-31.1/bin/bitcoind",
            "--version"
          ],
          "cwd": "/Users/cdjk/Downloads/ranklock-v0.25.2-claude-handoff/work/ranklock-v0.25.1",
          "duration_ms": 6,
          "env_digest": "9ac864309bcf14459523fdd45782bc8dd2c2b4c03d334b640da8259be7be821b",
          "exit_code": 0,
          "finished_at_utc": "2026-08-16T04:18:33.582480Z",
          "schema": "ranklock-v0252-command-record-v1",
          "started_at_utc": "2026-08-16T04:18:33.576039Z",
          "stderr_path": "results/v0252_logs/core-matrix-bitcoind-version.20260816T041833575774Z.stderr.log",
          "stderr_sha256": "e3b0c44298fc1c149afbf4c8996fb92427ae41e4649b934ca495991b7852b855",
          "stdout_path": "results/v0252_logs/core-matrix-bitcoind-version.20260816T041833575774Z.stdout.log",
          "stdout_sha256": "f2d7763364b8738a7e4b486d3d22f14b731a8be4c4d966a4f0f22273b24c593c",
          "timed_out": false
        }
      ],
      "description": "valid adaptive slot 1 chosen after slot-0 output",
      "evidence": {
        "adaptive_derivation": "derived from slot-0 released seed and labels, which exist only after slot 0 confirmed",
        "block_hash": "6de914a46f8f6f0535b59c593cdc643961bbe5eb7b9c340550deaf72d91b5409",
        "confirmations": 6,
        "labels_released_before_broadcast": true,
        "mempool_policy_allowed": true,
        "program_seed_commitment": "b14902ee63876b8a88a272102726c001f7d02866c82aa80e4ec575fe6196988c",
        "raw_transaction_sha256": "a6f2ce0a65b2162592e79577782fdf683c5c0eb6a80b56e67ea42432eb936f9d",
        "scope_limitation": "not the retained-program execution output; full retained-slot execution remains out of scope for this harness",
        "seed_released_only_after_confirmation": true,
        "selector_items": 512,
        "standard_policy_enabled": true,
        "txid": "d79e8b60b8edcb7687cf112fdc5b5b432df89c9fffec046322c3c97098f114ab",
        "witness_policy_sha256": "35ed3581df5d0c24d36a87c15e49711993ebb3b356807e8918109db18058b29f",
        "wtxid": "a16cc7a479a4464d73381b327d0df81b92ec7579ee83b99e12138ee2be89ebc9"
      },
      "schema": "ranklock-v0252-case-result-v1",
      "status": "passed"
    },
    "CORE-004": {
      "blocked_by": null,
      "case_id": "CORE-004",
      "commands": [
        {
          "argv": [
            "/tmp/core311/bitcoin-31.1/bin/bitcoind",
            "--version"
          ],
          "cwd": "/Users/cdjk/Downloads/ranklock-v0.25.2-claude-handoff/work/ranklock-v0.25.1",
          "duration_ms": 6,
          "env_digest": "9ac864309bcf14459523fdd45782bc8dd2c2b4c03d334b640da8259be7be821b",
          "exit_code": 0,
          "finished_at_utc": "2026-08-16T04:18:33.582480Z",
          "schema": "ranklock-v0252-command-record-v1",
          "started_at_utc": "2026-08-16T04:18:33.576039Z",
          "stderr_path": "results/v0252_logs/core-matrix-bitcoind-version.20260816T041833575774Z.stderr.log",
          "stderr_sha256": "e3b0c44298fc1c149afbf4c8996fb92427ae41e4649b934ca495991b7852b855",
          "stdout_path": "results/v0252_logs/core-matrix-bitcoind-version.20260816T041833575774Z.stdout.log",
          "stdout_sha256": "f2d7763364b8738a7e4b486d3d22f14b731a8be4c4d966a4f0f22273b24c593c",
          "timed_out": false
        }
      ],
      "description": "modified selected label is rejected",
      "evidence": {
        "expected": "rejected",
        "expected_reject_substring": "OP_VERIFY",
        "raw_transaction_sha256": "6042075bfe5264d5be47c2c34b2f72bf0ba1194b94b2ef980c59cbcfaea135be",
        "testmempoolaccept": {
          "allowed": false,
          "reject-details": "mempool-script-verify-flag-failed (Script failed an OP_VERIFY operation), input 0 of a349709f66ac449d210ec3e4bc5c040117328422d174196e2455bcbbbed75ec5 (wtxid 4c94c3e4ae28252238ff0c471c35ce09aa8ed33cc8760bdd6e854315800026de), spending 0978ece17d918afa3ff909c0dc97ba2bf56f73b78d0e8dc913946b89eb1ba9c6:1",
          "reject-reason": "mempool-script-verify-flag-failed (Script failed an OP_VERIFY operation)",
          "txid": "a349709f66ac449d210ec3e4bc5c040117328422d174196e2455bcbbbed75ec5",
          "wtxid": "4c94c3e4ae28252238ff0c471c35ce09aa8ed33cc8760bdd6e854315800026de"
        },
        "txid": "a349709f66ac449d210ec3e4bc5c040117328422d174196e2455bcbbbed75ec5"
      },
      "schema": "ranklock-v0252-case-result-v1",
      "status": "passed"
    },
    "CORE-005": {
      "blocked_by": "not yet driven through a live node scenario",
      "case_id": "CORE-005",
      "commands": [],
      "description": "wrong sibling/opening is rejected",
      "evidence": {
        "covered_by": "tests/test_protocol_negatives.py -- an opening that does not reconstruct the committed share root is refused",
        "limitation": "proven by the package suite, not against a live Bitcoin Core node; does not close the acceptance-matrix row"
      },
      "schema": "ranklock-v0252-case-result-v1",
      "status": "modeled_only"
    },
    "CORE-006": {
      "blocked_by": null,
      "case_id": "CORE-006",
      "commands": [
        {
          "argv": [
            "/tmp/core311/bitcoin-31.1/bin/bitcoind",
            "--version"
          ],
          "cwd": "/Users/cdjk/Downloads/ranklock-v0.25.2-claude-handoff/work/ranklock-v0.25.1",
          "duration_ms": 6,
          "env_digest": "9ac864309bcf14459523fdd45782bc8dd2c2b4c03d334b640da8259be7be821b",
          "exit_code": 0,
          "finished_at_utc": "2026-08-16T04:18:33.582480Z",
          "schema": "ranklock-v0252-command-record-v1",
          "started_at_utc": "2026-08-16T04:18:33.576039Z",
          "stderr_path": "results/v0252_logs/core-matrix-bitcoind-version.20260816T041833575774Z.stderr.log",
          "stderr_sha256": "e3b0c44298fc1c149afbf4c8996fb92427ae41e4649b934ca495991b7852b855",
          "stdout_path": "results/v0252_logs/core-matrix-bitcoind-version.20260816T041833575774Z.stdout.log",
          "stdout_sha256": "f2d7763364b8738a7e4b486d3d22f14b731a8be4c4d966a4f0f22273b24c593c",